{
  "$schema": "https://metabuilder.dev/schemas/package-playwright.schema.json",
  "package": "smoke_tests",
  "version": "1.0.0",
  "description": "Basic smoke tests converted from e2e/smoke.spec.ts - core application functionality tests",
  "tests": [
    {
      "name": "should load the application",
      "tags": ["@smoke", "@critical"],
      "timeout": 10000,
      "steps": [
        {
          "description": "Navigate to the app",
          "action": "navigate",
          "url": "/"
        },
        {
          "description": "Wait for page load",
          "action": "waitForLoadState",
          "state": "domcontentloaded"
        },
        {
          "description": "Verify page has content",
          "action": "expect",
          "selector": "body",
          "assertion": {
            "matcher": "toContainText",
            "expected": "WorkflowUI"
          }
        }
      ]
    },
    {
      "name": "should have proper page title",
      "tags": ["@smoke"],
      "steps": [
        {
          "action": "navigate",
          "url": "/"
        },
        {
          "description": "Verify title is set",
          "action": "expect",
          "assertion": {
            "matcher": "toHaveTitle",
            "title": "WorkflowUI - Visual Workflow Editor"
          }
        }
      ]
    },
    {
      "name": "should display WorkflowUI landing page",
      "tags": ["@smoke", "@ui"],
      "steps": [
        {
          "action": "navigate",
          "url": "/"
        },
        {
          "action": "waitForLoadState",
          "state": "domcontentloaded"
        },
        {
          "description": "Check Dashboard header",
          "action": "expect",
          "role": "heading",
          "text": "Workspaces",
          "assertion": {
            "matcher": "toBeVisible"
          }
        }
      ]
    },
    {
      "name": "should have viewport properly configured",
      "tags": ["@smoke"],
      "steps": [
        {
          "action": "navigate",
          "url": "/"
        },
        {
          "description": "Page should be visible",
          "action": "expect",
          "selector": "body",
          "assertion": {
            "matcher": "toBeVisible"
          }
        }
      ]
    }
  ]
}
